{
  "created_by": "acc_project tools/gen_signal_catalogue.py",
  "created_utc": "2026-08-18T20:21:53Z",
  "item_count": 65,
  "item_ids": [
    "ACC_CancelReq_Flg",
    "ACC_DrvOvrd_Enum",
    "ACC_FltCode_Enum",
    "ACC_HoldActive_Flg",
    "ACC_MainSw_Flg",
    "ACC_ResumeReq_Flg",
    "ACC_SetSpd_Kph",
    "ACC_Status",
    "ACC_TimeGapSet",
    "ACC_TimeGapSet_s",
    "ACC_TrgtDetd_Flg",
    "ACC_Warn_Enum",
    "AccelReq_mps2",
    "BrkLmpReq_Flg",
    "BrkLmp_Actv_Flg",
    "BrkPress_Bar",
    "BrkReq_mps2",
    "DrvAccPedal_Pct",
    "DrvBrkPedal_Pct",
    "EgoDist_m",
    "EngTrqReq_Nm",
    "RoadCurv_1pm",
    "VehAccel_mps2",
    "VehLatAccel_mps2",
    "VehSpd_Kph",
    "VehStandstill_Flg",
    "VehYawRate_dps",
    "Obj2_Azimuth_deg",
    "Obj2_Dist_m",
    "Obj2_ID",
    "Obj2_InLane_Flg",
    "Obj2_LatOfs_m",
    "Obj2_ObjType_Enum",
    "Obj2_RelSpd_mps",
    "Obj2_Valid_Flg",
    "Obj3_Azimuth_deg",
    "Obj3_Dist_m",
    "Obj3_ID",
    "Obj3_InLane_Flg",
    "Obj3_LatOfs_m",
    "Obj3_ObjType_Enum",
    "Obj3_RelSpd_mps",
    "Obj3_Valid_Flg",
    "Rdr_ObjCnt",
    "Rdr_Sts_Enum",
    "Trgt_Azimuth_deg",
    "Trgt_Dist_m",
    "Trgt_ID",
    "Trgt_InLane_Flg",
    "Trgt_LatOfs_m",
    "Trgt_ObjType_Enum",
    "Trgt_RelAccel_mps2",
    "Trgt_RelSpd_mps",
    "Trgt_TTC_s",
    "Trgt_Valid_Flg",
    "Ref_AccelCmdRaw_mps2",
    "Ref_CtrlState_Enum",
    "Ref_DesGap_m",
    "Ref_EgoAccel_mps2",
    "Ref_EgoSpd_mps",
    "Ref_Gap_m",
    "Ref_LeadAccel_mps2",
    "Ref_LeadLatOfs_m",
    "Ref_LeadSpd_mps",
    "Ref_RoadCurv_1pm"
  ],
  "items": [
    {
      "channel_group": "ACC_HMI_10Hz",
      "column_type": "int32",
      "dtype": "uint8",
      "enum_map": null,
      "notes": "Driver CANCEL input. MF4 unit string: ''; published ASCII-canonicalised.",
      "quantisation": null,
      "raster_hz": 10,
      "role": "stimulus",
      "schema_version": "1.0.0",
      "signal": "ACC_CancelReq_Flg",
      "source_spec": "dev-planning/acc-plant-mf4/spec.md (rev 2)",
      "table": "acc_hmi_10hz",
      "unit": "1"
    },
    {
      "channel_group": "ACC_HMI_10Hz",
      "column_type": "int32",
      "dtype": "uint8",
      "enum_map": {
        "0": "none",
        "1": "brake",
        "2": "accelerator"
      },
      "notes": "Override cause: 0=none, 1=brake, 2=accelerator. MF4 unit string: ''; published ASCII-canonicalised.",
      "quantisation": null,
      "raster_hz": 10,
      "role": "response",
      "schema_version": "1.0.0",
      "signal": "ACC_DrvOvrd_Enum",
      "source_spec": "dev-planning/acc-plant-mf4/spec.md (rev 2)",
      "table": "acc_hmi_10hz",
      "unit": "1"
    },
    {
      "channel_group": "ACC_HMI_10Hz",
      "column_type": "int32",
      "dtype": "uint8",
      "enum_map": {
        "0": "none",
        "1": "sensor",
        "2": "actuator",
        "3": "plausibility"
      },
      "notes": "Fault code: 0=none, 1=sensor, 2=actuator, 3=plausibility. MF4 unit string: ''; published ASCII-canonicalised.",
      "quantisation": null,
      "raster_hz": 10,
      "role": "response",
      "schema_version": "1.0.0",
      "signal": "ACC_FltCode_Enum",
      "source_spec": "dev-planning/acc-plant-mf4/spec.md (rev 2)",
      "table": "acc_hmi_10hz",
      "unit": "1"
    },
    {
      "channel_group": "ACC_HMI_10Hz",
      "column_type": "int32",
      "dtype": "uint8",
      "enum_map": null,
      "notes": "Hold telltale. Redundant with ACC_Status == 4 BY DESIGN: production buses publish both, and a checker should be able to use either. MF4 unit string: ''; published ASCII-canonicalised.",
      "quantisation": null,
      "raster_hz": 10,
      "role": "response",
      "schema_version": "1.0.0",
      "signal": "ACC_HoldActive_Flg",
      "source_spec": "dev-planning/acc-plant-mf4/spec.md (rev 2)",
      "table": "acc_hmi_10hz",
      "unit": "1"
    },
    {
      "channel_group": "ACC_HMI_10Hz",
      "column_type": "int32",
      "dtype": "uint8",
      "enum_map": null,
      "notes": "ACC main switch position. MF4 unit string: ''; published ASCII-canonicalised.",
      "quantisation": null,
      "raster_hz": 10,
      "role": "stimulus",
      "schema_version": "1.0.0",
      "signal": "ACC_MainSw_Flg",
      "source_spec": "dev-planning/acc-plant-mf4/spec.md (rev 2)",
      "table": "acc_hmi_10hz",
      "unit": "1"
    },
    {
      "channel_group": "ACC_HMI_10Hz",
      "column_type": "int32",
      "dtype": "uint8",
      "enum_map": null,
      "notes": "Driver RESUME / 'Go' input. MF4 unit string: ''; published ASCII-canonicalised.",
      "quantisation": null,
      "raster_hz": 10,
      "role": "stimulus",
      "schema_version": "1.0.0",
      "signal": "ACC_ResumeReq_Flg",
      "source_spec": "dev-planning/acc-plant-mf4/spec.md (rev 2)",
      "table": "acc_hmi_10hz",
      "unit": "1"
    },
    {
      "channel_group": "ACC_HMI_10Hz",
      "column_type": "double",
      "dtype": "float32",
      "enum_map": null,
      "notes": "Currently active set speed, clamped to speed.v_set_max_kph. Zero before the first SET, because no set speed exists yet.",
      "quantisation": null,
      "raster_hz": 10,
      "role": "response",
      "schema_version": "1.0.0",
      "signal": "ACC_SetSpd_Kph",
      "source_spec": "dev-planning/acc-plant-mf4/spec.md (rev 2)",
      "table": "acc_hmi_10hz",
      "unit": "km/h"
    },
    {
      "channel_group": "ACC_HMI_10Hz",
      "column_type": "int32",
      "dtype": "uint8",
      "enum_map": {
        "0": "Off",
        "1": "Standby",
        "2": "Active-Cruise",
        "3": "Active-Follow",
        "4": "Active-Hold",
        "5": "Driver-Override",
        "6": "Degraded/Fault"
      },
      "notes": "ACC state: 0=Off,1=Standby,2=Active-Cruise,3=Active-Follow,4=Active-Hold,5=Driver-Override,6=Degraded/Fault. MF4 unit string: ''; published ASCII-canonicalised.",
      "quantisation": null,
      "raster_hz": 10,
      "role": "response",
      "schema_version": "1.0.0",
      "signal": "ACC_Status",
      "source_spec": "dev-planning/acc-plant-mf4/spec.md (rev 2)",
      "table": "acc_hmi_10hz",
      "unit": "1"
    },
    {
      "channel_group": "ACC_HMI_10Hz",
      "column_type": "int32",
      "dtype": "uint8",
      "enum_map": null,
      "notes": "Selected time-gap setting, 1-based index into spacing.tau_settings_s. MF4 unit string: ''; published ASCII-canonicalised.",
      "quantisation": null,
      "raster_hz": 10,
      "role": "stimulus",
      "schema_version": "1.0.0",
      "signal": "ACC_TimeGapSet",
      "source_spec": "dev-planning/acc-plant-mf4/spec.md (rev 2)",
      "table": "acc_hmi_10hz",
      "unit": "1"
    },
    {
      "channel_group": "ACC_HMI_10Hz",
      "column_type": "double",
      "dtype": "float32",
      "enum_map": null,
      "notes": "The tau value of the selected setting, in seconds.",
      "quantisation": null,
      "raster_hz": 10,
      "role": "response",
      "schema_version": "1.0.0",
      "signal": "ACC_TimeGapSet_s",
      "source_spec": "dev-planning/acc-plant-mf4/spec.md (rev 2)",
      "table": "acc_hmi_10hz",
      "unit": "s"
    },
    {
      "channel_group": "ACC_HMI_10Hz",
      "column_type": "int32",
      "dtype": "uint8",
      "enum_map": null,
      "notes": "'Vehicle ahead detected' telltale: the primary slot is valid. This is the annunciation COMMAND; display rendering is out of scope for MF4 verification (spec 6.6). MF4 unit string: ''; published ASCII-canonicalised.",
      "quantisation": null,
      "raster_hz": 10,
      "role": "response",
      "schema_version": "1.0.0",
      "signal": "ACC_TrgtDetd_Flg",
      "source_spec": "dev-planning/acc-plant-mf4/spec.md (rev 2)",
      "table": "acc_hmi_10hz",
      "unit": "1"
    },
    {
      "channel_group": "ACC_HMI_10Hz",
      "column_type": "int32",
      "dtype": "uint8",
      "enum_map": {
        "0": "none",
        "1": "info",
        "2": "takeover request"
      },
      "notes": "Annunciation COMMAND: 0=none, 1=info, 2=takeover request. What the ACC asks for, never evidence of what the driver saw or heard (spec 6.6). MF4 unit string: ''; published ASCII-canonicalised.",
      "quantisation": null,
      "raster_hz": 10,
      "role": "response",
      "schema_version": "1.0.0",
      "signal": "ACC_Warn_Enum",
      "source_spec": "dev-planning/acc-plant-mf4/spec.md (rev 2)",
      "table": "acc_hmi_10hz",
      "unit": "1"
    },
    {
      "channel_group": "PT_CAN_100Hz",
      "column_type": "double",
      "dtype": "float32",
      "enum_map": null,
      "notes": "ACC positive acceleration request after the whole limiter chain, max(a_cmd, 0). MF4 unit string: 'm/s²'; published ASCII-canonicalised.",
      "quantisation": null,
      "raster_hz": 100,
      "role": "response",
      "schema_version": "1.0.0",
      "signal": "AccelReq_mps2",
      "source_spec": "dev-planning/acc-plant-mf4/spec.md (rev 2)",
      "table": "acc_pt_can_100hz",
      "unit": "m/s^2"
    },
    {
      "channel_group": "PT_CAN_100Hz",
      "column_type": "int32",
      "dtype": "uint8",
      "enum_map": null,
      "notes": "Brake-lamp REQUEST from the ACC: asserted when BrkReq_mps2 falls below brake_light.threshold_mps2, delayed by brake_light.request_latency_s. MF4 unit string: ''; published ASCII-canonicalised.",
      "quantisation": null,
      "raster_hz": 100,
      "role": "response",
      "schema_version": "1.0.0",
      "signal": "BrkLmpReq_Flg",
      "source_spec": "dev-planning/acc-plant-mf4/spec.md (rev 2)",
      "table": "acc_pt_can_100hz",
      "unit": "1"
    },
    {
      "channel_group": "PT_CAN_100Hz",
      "column_type": "int32",
      "dtype": "uint8",
      "enum_map": null,
      "notes": "Brake-lamp ACTUAL state: the request delayed by brake_light.actuation_latency_s. Two signals, not one: a requirement written on illumination needs the lamp state, not the request. MF4 unit string: ''; published ASCII-canonicalised.",